{
  "id": "cutover-drain-in-flight-only",
  "behavior": "cutover-drain-counts-in-flight-not-branches",
  "class": "classification",
  "deterministic": true,
  "repeats": 2,
  "tests": [
    "drain counts a live worktree and an open task with no turn-end, and nothing else"
  ],
  "dangerousStates": [
    {
      "kind": "mutation",
      "file": "src/cutover.ts",
      "find": "  return items.sort((a, b) => `${a.kind}/${a.id}`.localeCompare(`${b.kind}/${b.id}`));",
      "replace": "  const heads = runGit(fleet.root, [\n    \"for-each-ref\",\n    \"--format=%(refname:short)\",\n    \"refs/remotes/origin\",\n  ]);\n  for (const line of heads.stdout.split(\"\\n\")) {\n    const name = line.trim();\n    if (name.length > 0 && name !== \"origin/main\") {\n      items.push({ kind: \"task\", id: name, detail: \"unmerged branch\" });\n    }\n  }\n  return items.sort((a, b) => `${a.kind}/${a.id}`.localeCompare(`${b.kind}/${b.id}`));"
    },
    {
      "kind": "mutation",
      "file": "src/cutover.ts",
      "find": "    if (turnEnd.kind === \"regular\") {\n      continue;\n    }",
      "replace": "    if (turnEnd.kind === \"regular\" || turnEnd.kind === \"absent\") {\n      continue;\n    }"
    }
  ],
  "consumesExternalOutput": {
    "program": "remote / status --porcelain / push",
    "captures": [
      "witness/captures/cutover-git-contracts.txt"
    ],
    "provenance": "src/cutover.ts spawns the version-control program and parses what it prints: `remote` decides whether a fleet has an origin, `status --porcelain` decides whether a tree is dirty, and `push` decides whether the rolled-back state landed. Red-witness rule (f) therefore binds every witness over that file. The cited capture is a real run, taken 2026-09-16 against version 2.43.0, and the named test `the captured git contract this module parses is reproduced live` reproduces each contract in a live scratch repository and requires the live result to match the capture, so nothing here is a hand-written string chosen to match the implementation. Two recorded facts earn their place: an empty stdout with exit 0 is what makes no-origin and clean-tree decidable, and a push to a path that is not a repository exits 128 rather than 1, which is why syncFleetState tests for non-zero rather than for 1."
  }
}
