{
  "id": "credential-scrub-egress-vocabulary-bounds",
  "behavior": "credential-scrub-egress-vocabulary-bounds",
  "tests": [
    "the egress vocabulary excludes the names measured to grant no reach, and does not widen the extension refusal"
  ],
  "class": "additive",
  "dangerousStates": [
    {
      "kind": "mutation",
      "file": "src/gates/credentials.ts",
      "find": "  \"ftp_proxy\",\n];",
      "replace": "  \"ftp_proxy\",\n  \"no_proxy\",\n];"
    },
    {
      "kind": "mutation",
      "file": "src/gates/credentials.ts",
      "find": "export function isEgressEnvName(name: string): boolean {\n  return EGRESS_ENV_VOCABULARY.includes(name);\n}",
      "replace": "export function isEgressEnvName(name: string): boolean {\n  return name.length > 0 || EGRESS_ENV_VOCABULARY.includes(name);\n}"
    }
  ],
  "deterministic": true,
  "repeats": 2,
  "consumesExternalOutput": {
    "program": "/usr/bin/git config --get-all credential.helper",
    "captures": [
      "witness/captures/macos-apple-git-prefix-helper.txt"
    ],
    "provenance": "rule (f) binds this witness because src/gates/credentials.ts spawns git and gh and reads their exit codes: the environment probe under test sits in the same walk as source git-resolved-config, which asks git itself, with no scope flag, what credential.helper resolves from inside the child. The cited capture is the real Apple Git prefix-helper output already carried by this repository, and test/credentials-gate.test.ts reads it and requires a live git to reproduce the recorded contract before any scrubbed-child assertion runs, so the probe behaviour is anchored to real git output rather than to a hand-written string (CLAUDE.md warning 10)."
  }
}
